Enter password: ****
Welcome to the MySQL monitor.  Commands end with ; or \g.
Your MySQL connection id is 8
Server version: 8.0.39 MySQL Community Server - GPL

Copyright (c) 2000, 2024, Oracle and/or its affiliates.

Oracle is a registered trademark of Oracle Corporation and/or its
affiliates. Other names may be trademarks of their respective
owners.

Type 'help;' or '\h' for help. Type '\c' to clear the current input statement.

mysql> show databases;


mysql> use batch8_9

mysql> show tables;

mysql> select * from student;

mysql> alter table student add column city varchar(20);

mysql> describe student;

mysql> select * from student;


mysql> update student set city="Surat" where rollno=1;

mysql> select * from student;

mysql> update student set city="Vapi" where rollno=2;

mysql> update student set city="Vapi" where rollno=3;

mysql> update student set city="Kim" where rollno=4;

mysql> select * from student;
+--------+---------+------------+------------+-------+
| rollno | name    | mobile_no  | Dob        | city  |
+--------+---------+------------+------------+-------+
|      1 | Mayuri  | 9632147853 | 2001-05-24 | Surat |
|      2 | Darshti | 7412589632 | 2000-01-03 | Vapi  |
|      3 | Rudra   |  951247863 | 2003-08-14 | Vapi  |
|      4 | Kanha   | 8521479632 | 2004-12-25 | Kim   |
+--------+---------+------------+------------+-------+
4 rows in set (0.00 sec)


mysql> alter table student add column age int after name;

mysql> select * from student;
+--------+---------+------+------------+------------+-------+
| rollno | name    | age  | mobile_no  | Dob        | city  |
+--------+---------+------+------------+------------+-------+
|      1 | Mayuri  | NULL | 9632147853 | 2001-05-24 | Surat |
|      2 | Darshti | NULL | 7412589632 | 2000-01-03 | Vapi  |
|      3 | Rudra   | NULL |  951247863 | 2003-08-14 | Vapi  |
|      4 | Kanha   | NULL | 8521479632 | 2004-12-25 | Kim   |
+--------+---------+------+------------+------------+-------+
4 rows in set (0.00 sec)

mysql> alter table student modify age tinyint;

mysql> describe student
    -> ;
+-----------+-------------+------+-----+---------+-------+
| Field     | Type        | Null | Key | Default | Extra |
+-----------+-------------+------+-----+---------+-------+
| rollno    | int         | NO   | PRI | NULL    |       |
| name      | varchar(30) | YES  |     | NULL    |       |
| age       | tinyint     | YES  |     | NULL    |       |
| mobile_no | bigint      | YES  |     | NULL    |       |
| Dob       | date        | YES  |     | NULL    |       |
| city      | varchar(20) | YES  |     | NULL    |       |
+-----------+-------------+------+-----+---------+-------+
6 rows in set (0.00 sec)

mysql> alter table student drop age;

mysql> describe student;

/*the next command is optional.*/
mysql> drop table student; 

/ *truncate to delete all the rows at one time.*/
mysql> truncate student;

mysql> show tables;
+--------------------+
| Tables_in_batch8_9 |
+--------------------+
| student            |
+--------------------+
1 row in set (0.00 sec)

mysql> describe student;
+-----------+-------------+------+-----+---------+-------+
| Field     | Type        | Null | Key | Default | Extra |
+-----------+-------------+------+-----+---------+-------+
| rollno    | int         | NO   | PRI | NULL    |       |
| name      | varchar(30) | YES  |     | NULL    |       |
| mobile_no | bigint      | YES  |     | NULL    |       |
| Dob       | date        | YES  |     | NULL    |       |
+-----------+-------------+------+-----+---------+-------+
4 rows in set (0.00 sec)

mysql> delete from student where rollno =3;
mysql> select * from student;
+--------+---------+------------+------------+
| rollno | name    | mobile_no  | Dob        |
+--------+---------+------------+------------+
|      1 | Mayuri  | 9632147853 | 2001-05-24 |
|      2 | Darshti | 7412589632 | 2000-01-03 |
|      4 | Kanha   | 8521479632 | 2004-12-25 |
+--------+---------+------------+------------+
3 rows in set (0.00 sec)

mysql> create table customer (c_id int primary key,name varchar(20) not null,mobile_no bigint unique,city varchar(20) default "surat",age int check(age>18));

mysql> create table payment (pay_id int primary key, cid int,foreign key(cid) references customer(c_id), pay_amount int,pay_mode varchar(20),pay_date date);

